statement ok
DROP TABLE IF EXISTS test_delete_with_hnsw;

statement ok
CREATE TABLE test_delete_with_hnsw (c1 INT, c2 EMBEDDING(FLOAT, 4));

# 1. dist: 0.22
# 2. dist: 0.1
# 3. dist: 0.06
# 4. dist: 0.02
query I
COPY test_delete_with_hnsw FROM '/tmp/infinity/test_data/embedding_float_dim4.csv' WITH (DELIMITER ',');
----

query I
COPY test_delete_with_hnsw FROM '/tmp/infinity/test_data/embedding_float_dim4.csv' WITH (DELIMITER ',');
----

statement ok
CREATE INDEX idx1 ON test_delete_with_hnsw (c2) USING Hnsw WITH (M = 16, ef_construction = 200, metric = l2);

query I
SELECT c1 FROM test_delete_with_hnsw SEARCH KNN(c2, [0.3, 0.3, 0.2, 0.2], 'float', 'l2', 3) WITH (ef = 4);
----
8
8
6

statement ok
DELETE FROM test_delete_with_hnsw WHERE c1 = 6;

query I
SELECT c1 FROM test_delete_with_hnsw SEARCH KNN(c2, [0.3, 0.3, 0.2, 0.2], 'float', 'l2', 3) WITH (ef = 4);
----
8
8
4

query I
COPY test_delete_with_hnsw FROM '/tmp/infinity/test_data/embedding_float_dim4.csv' WITH (DELIMITER ',');
----

query I
SELECT c1 FROM test_delete_with_hnsw SEARCH KNN(c2, [0.3, 0.3, 0.2, 0.2], 'float', 'l2', 3) WITH (ef = 4);
----
8
8
8

statement ok
DELETE FROM test_delete_with_hnsw WHERE c1 = 8;

query I
SELECT c1 FROM test_delete_with_hnsw SEARCH KNN(c2, [0.3, 0.3, 0.2, 0.2], 'float', 'l2', 3) WITH (ef = 4);
----
6
4
4
