statement ok
DROP TABLE IF EXISTS test_delete_with_hnsw;

statement ok
CREATE TABLE test_delete_with_hnsw (c1 INT, c2 EMBEDDING(FLOAT, 4));

# 2, dist: 0.22
# 4, dist: 0.1
# 6, dist: 0.06
# 8, dist: 0.02
query I
COPY test_delete_with_hnsw FROM '/var/infinity/test_data/embedding_float_dim4.csv' WITH (DELIMITER ',', FORMAT CSV);
----

query I
COPY test_delete_with_hnsw FROM '/var/infinity/test_data/embedding_float_dim4.csv' WITH (DELIMITER ',', FORMAT CSV);
----

statement ok
DELETE FROM test_delete_with_hnsw WHERE c1 = 8;

query I
SELECT c1 FROM test_delete_with_hnsw SEARCH MATCH VECTOR (c2, [0.3, 0.3, 0.2, 0.2], 'float', 'l2', 3) WITH (ef = 4);
----
6
6
4

statement ok
CREATE INDEX idx1 ON test_delete_with_hnsw (c2) USING Hnsw WITH (M = 16, ef_construction = 200, metric = l2);

query I
SELECT c1 FROM test_delete_with_hnsw SEARCH MATCH VECTOR (c2, [0.3, 0.3, 0.2, 0.2], 'float', 'l2', 3) WITH (ef = 4);
----
6
6
4

statement ok
DELETE FROM test_delete_with_hnsw WHERE c1 = 6;

query I
SELECT c1 FROM test_delete_with_hnsw SEARCH MATCH VECTOR (c2, [0.3, 0.3, 0.2, 0.2], 'float', 'l2', 3) WITH (ef = 4);
----
4
4
2

query I
COPY test_delete_with_hnsw FROM '/var/infinity/test_data/embedding_float_dim4.csv' WITH (DELIMITER ',', FORMAT CSV);
----

query I
SELECT c1 FROM test_delete_with_hnsw SEARCH MATCH VECTOR (c2, [0.3, 0.3, 0.2, 0.2], 'float', 'l2', 3) WITH (ef = 4);
----
8
6
4

statement ok
DELETE FROM test_delete_with_hnsw WHERE c1 = 8;

query I
SELECT c1 FROM test_delete_with_hnsw SEARCH MATCH VECTOR (c2, [0.3, 0.3, 0.2, 0.2], 'float', 'l2', 3) WITH (ef = 4);
----
6
4
4

statement ok
DROP TABLE test_delete_with_hnsw;
