statement ok
DROP TABLE IF EXISTS test_delete_with_annivfflat;

statement ok
CREATE TABLE test_delete_with_annivfflat (c1 INT, c2 EMBEDDING(FLOAT, 4));

# 2, dist: 0.22
# 4, dist: 0.1
# 6, dist: 0.06
# 8, dist: 0.02
query I
COPY test_delete_with_annivfflat FROM '/var/infinity/test_data/embedding_float_dim4.csv' WITH (DELIMITER ',', FORMAT CSV);
----

query I
COPY test_delete_with_annivfflat FROM '/var/infinity/test_data/embedding_float_dim4.csv' WITH (DELIMITER ',', FORMAT CSV);
----

statement ok
DELETE FROM test_delete_with_annivfflat WHERE c1 = 8;

query I
SELECT c1 FROM test_delete_with_annivfflat SEARCH MATCH VECTOR (c2, [0.3, 0.3, 0.2, 0.2], 'float', 'l2', 3);
----
6
6
4

statement ok
CREATE INDEX idx1 ON test_delete_with_annivfflat (c2) USING IVFFlat WITH (centroids_count = 1, metric = l2);

query I
SELECT c1 FROM test_delete_with_annivfflat SEARCH MATCH VECTOR (c2, [0.3, 0.3, 0.2, 0.2], 'float', 'l2', 3);
----
6
6
4

statement ok
DELETE FROM test_delete_with_annivfflat WHERE c1 = 6;

query I
SELECT c1 FROM test_delete_with_annivfflat SEARCH MATCH VECTOR (c2, [0.3, 0.3, 0.2, 0.2], 'float', 'l2', 3);
----
4
4
2

query I
COPY test_delete_with_annivfflat FROM '/var/infinity/test_data/embedding_float_dim4.csv' WITH (DELIMITER ',', FORMAT CSV);
----

query I
SELECT c1 FROM test_delete_with_annivfflat SEARCH MATCH VECTOR (c2, [0.3, 0.3, 0.2, 0.2], 'float', 'l2', 3);
----
8
6
4

statement ok
DELETE FROM test_delete_with_annivfflat WHERE c1 = 8;

query I
SELECT c1 FROM test_delete_with_annivfflat SEARCH MATCH VECTOR (c2, [0.3, 0.3, 0.2, 0.2], 'float', 'l2', 3);
----
6
4
4

statement ok
DROP TABLE test_delete_with_annivfflat;
