#####init

statement ok
DROP TABLE IF EXISTS t1;

statement ok
DROP DATABASE IF EXISTS sqllogic_db1;

######

statement ok
CREATE DATABASE sqllogic_db1;

statement error
CREATE DATABASE sqllogic_db1;

statement ok
CREATE DATABASE IF NOT EXISTS sqllogic_db1;

statement ok
USE sqllogic_db1;

statement ok
CREATE TABLE t1 (c1 INT, c2 INT, c3 INT);

statement ok
INSERT INTO t1 VALUES (1, 2, 3);

query III
SELECT * FROM t1;
----
1 2 3

statement ok
USE default_db;

statement ok
CREATE TABLE t1 (c1 INT, c2 INT, c3 INT);

statement ok
INSERT INTO t1 VALUES (4, 5, 6);

query III
SELECT * FROM t1;
----
4 5 6

query III
SELECT * FROM sqllogic_db1.t1;
----
1 2 3

statement ok
INSERT INTO sqllogic_db1.t1 VALUES(7, 8, 9);

query III
SELECT * FROM sqllogic_db1.t1;
----
1 2 3
7 8 9

statement ok
DELETE FROM sqllogic_db1.t1 WHERE c1 = 1;

query III
SELECT * FROM sqllogic_db1.t1;
----
7 8 9

statement ok
DROP TABLE sqllogic_db1.t1;

statement error
SELECT * FROM sqllogic_db1.t1;

statement ok
DROP DATABASE sqllogic_db1;