statement ok
DROP TABLE IF EXISTS test_fp16_bf16;

statement ok
CREATE TABLE test_fp16_bf16 (c1 float, c2 float16, c3 bfloat16);

# insert

statement ok
INSERT INTO test_fp16_bf16 VALUES (-1, 1, -1), (2, -2, 2), (-3, 3, -3), (4, -4, 4), (-5, 5, -5);

# output

query I
SELECT * FROM test_fp16_bf16;
----
-1.000000 1.000000 -1.000000
2.000000 -2.000000 2.000000
-3.000000 3.000000 -3.000000
4.000000 -4.000000 4.000000
-5.000000 5.000000 -5.000000

# compare

query II
SELECT * FROM test_fp16_bf16 WHERE c1 > 0;
----
2.000000 -2.000000 2.000000
4.000000 -4.000000 4.000000

query III
SELECT * FROM test_fp16_bf16 WHERE c2 > 0;
----
-1.000000 1.000000 -1.000000
-3.000000 3.000000 -3.000000
-5.000000 5.000000 -5.000000

query IV
SELECT * FROM test_fp16_bf16 WHERE c3 > 0;
----
2.000000 -2.000000 2.000000
4.000000 -4.000000 4.000000

query V
SELECT * FROM test_fp16_bf16 WHERE c1 > 0 and c2 > 0;
----

# multiply

query VI
SELECT c1 * c2, c1 * c3, c2 * c3, c1 * c2 * c3 FROM test_fp16_bf16;
----
-1.000000 1.000000 -1.000000 1.000000
-4.000000 4.000000 -4.000000 -8.000000
-9.000000 9.000000 -9.000000 27.000000
-16.000000 16.000000 -16.000000 -64.000000
-25.000000 25.000000 -25.000000 125.000000

# sort

query VII
SELECT * FROM test_fp16_bf16 ORDER BY c1;
----
-5.000000 5.000000 -5.000000
-3.000000 3.000000 -3.000000
-1.000000 1.000000 -1.000000
2.000000 -2.000000 2.000000
4.000000 -4.000000 4.000000

query VIII
SELECT * FROM test_fp16_bf16 ORDER BY c2;
----
4.000000 -4.000000 4.000000
2.000000 -2.000000 2.000000
-1.000000 1.000000 -1.000000
-3.000000 3.000000 -3.000000
-5.000000 5.000000 -5.000000

query IX
SELECT * FROM test_fp16_bf16 ORDER BY c3 DESC;
----
4.000000 -4.000000 4.000000
2.000000 -2.000000 2.000000
-1.000000 1.000000 -1.000000
-3.000000 3.000000 -3.000000
-5.000000 5.000000 -5.000000

query X
SELECT * FROM test_fp16_bf16 ORDER BY c2 * c3;
----
-5.000000 5.000000 -5.000000
4.000000 -4.000000 4.000000
-3.000000 3.000000 -3.000000
2.000000 -2.000000 2.000000
-1.000000 1.000000 -1.000000

query XI
SELECT * FROM test_fp16_bf16 ORDER BY c2 + c3 DESC, c1 * c2 ASC;
----
-5.000000 5.000000 -5.000000
4.000000 -4.000000 4.000000
-3.000000 3.000000 -3.000000
2.000000 -2.000000 2.000000
-1.000000 1.000000 -1.000000

# agg

query XII
SELECT sum(c1), sum(c2), sum(c3), avg(c1), avg(c2), avg(c3), count(c1), count(c2), count(c3) FROM test_fp16_bf16;
----
-3.000000 3.000000 -3.000000 -0.600000 0.600000 -0.600000 5 5 5

# delete

statement ok
DELETE FROM test_fp16_bf16 WHERE (-c2 > 0 or -c1 > 4);

query XIII
SELECT * FROM test_fp16_bf16;
----
-1.000000 1.000000 -1.000000
-3.000000 3.000000 -3.000000

statement ok
DELETE FROM test_fp16_bf16 WHERE +c3 < -2;

query XIV
SELECT * FROM test_fp16_bf16;
----
-1.000000 1.000000 -1.000000

statement ok
DROP TABLE test_fp16_bf16;
