statement ok
DROP TABLE IF EXISTS test_knn_sparse_bmp_filter;

statement ok
CREATE TABLE test_knn_sparse_bmp_filter (col1 INT, col2 SPARSE(FLOAT,100));

statement ok
CREATE INDEX idx1 ON test_knn_sparse_bmp_filter (col2) USING Bmp WITH (block_size = 8, compress_type = compress);

statement ok
COPY test_knn_sparse_bmp_filter FROM '/var/infinity/test_data/sparse_knn.csv' WITH (FORMAT CSV);

query I
SELECT col1 FROM test_knn_sparse_bmp_filter SEARCH MATCH SPARSE (col2, [0:1.0,20:2.0,80:3.0], 'ip', 3);
----
4
2
1

query I
SELECT col1 FROM test_knn_sparse_bmp_filter SEARCH MATCH SPARSE (col2, [0:1.0,20:2.0,80:3.0], 'ip', 3) WHERE col1 < 4;
----
2
1
3

statement ok
COPY test_knn_sparse_bmp_filter FROM '/var/infinity/test_data/sparse_knn.csv' WITH (FORMAT CSV);

query I
SELECT col1 FROM test_knn_sparse_bmp_filter SEARCH MATCH SPARSE (col2, [0:1.0,20:2.0,80:3.0], 'ip', 3);
----
4
4
2

query I
SELECT col1 FROM test_knn_sparse_bmp_filter SEARCH MATCH SPARSE (col2, [0:1.0,20:2.0,80:3.0], 'ip', 3) where col1 < 4;
----
2
2
1

query I
SELECT col1 FROM test_knn_sparse_bmp_filter SEARCH MATCH SPARSE (col2, [0:1.0,20:2.0,80:3.0], 'ip', 3, where col1 < 4);
----
2
2
1

statement ok
DELETE FROM test_knn_sparse_bmp_filter WHERE col1 = 4;

query I
SELECT col1 FROM test_knn_sparse_bmp_filter SEARCH MATCH SPARSE (col2, [0:1.0,20:2.0,80:3.0], 'ip', 3);
----
2
2
1

statement ok
DROP TABLE test_knn_sparse_bmp_filter;

