# name: test/sql/dml/insert.slt
# description: Test insert
# group: [dml, insert]

# Parse only support
statement ok
CREATE TABLE products (product_no integer, price integer);

# insert data
query I
INSERT INTO products VALUES (1, 2), (3, 4);
----

query I
INSERT INTO products VALUES (5, 6), (7, 8);
----

query II rowsort
SELECT * FROM products;
----
1 2
3 4
5 6
7 8

statement ok
DELETE FROM products WHERE product_no = 3;

query II rowsort
SELECT * FROM products;
----
1 2
5 6
7 8

statement ok
DELETE FROM products;

# Table has already been dropped
statement error
DROP TABLE products;
