# name: test/sql/dml/delete.slt
# description: Test delete
# group: [dml, delete]

# Parse only support
statement ok
CREATE TABLE products (product_no integer, price integer);

# insert data
query I
INSERT INTO products VALUES (1, 2), (3, 4);
----

query I
INSERT INTO products VALUES (5, 6), (7, 8);
----

query II rowsort
SELECT * FROM products;
----
1 2
3 4
5 6
7 8

query II
SELECT count(*) FROM products;
----
4

statement ok
DELETE FROM products WHERE product_no = 3;

query II rowsort
SELECT * FROM products;
----
1 2
5 6
7 8

query II
SELECT count(*) FROM products;
----
3

statement ok
DELETE FROM products;

statement ok
DROP TABLE products;
