# name: test/sql/dml/update.slt
# description: Test update
# group: [dml, update]

# Parse only support
statement ok
CREATE TABLE products (product_no integer, price integer);

# insert data
query I
INSERT INTO products VALUES (1, 2), (3, 4);
----

query I
INSERT INTO products VALUES (5, 6), (7, 8);
----

query II rowsort
SELECT * FROM products;
----
1 2
3 4
5 6
7 8

query II
SELECT count(*) FROM products;
----
4

statement ok
UPDATE products SET price=100 WHERE product_no = 3;

query II rowsort
SELECT * FROM products;
----
1 2
3 100
5 6
7 8

query II
SELECT count(*) FROM products;
----
4


statement ok
UPDATE products SET price=price+3 WHERE product_no = 1 OR product_no = 5;

query II rowsort
SELECT * FROM products;
----
1 5
3 100
5 9
7 8

statement ok
DROP TABLE products;
